{
  "schema_version": "0.1.0",
  "target": "fixtures/mixed-ecosystem",
  "inventory": {
    "ecosystems": [
      {
        "id": "ecosystem:go",
        "name": "go",
        "kind": "ecosystem",
        "locations": [
          {
            "path": "go.mod"
          },
          {
            "path": "go.sum"
          }
        ]
      },
      {
        "id": "ecosystem:node",
        "name": "node",
        "kind": "ecosystem",
        "locations": [
          {
            "path": "package-lock.json"
          },
          {
            "path": "package.json"
          }
        ]
      },
      {
        "id": "ecosystem:python",
        "name": "python",
        "kind": "ecosystem",
        "locations": [
          {
            "path": "python/poetry.lock"
          },
          {
            "path": "python/pyproject.toml"
          }
        ]
      }
    ],
    "package_managers": [
      {
        "id": "package_manager:go",
        "name": "go",
        "kind": "package_manager",
        "locations": [
          {
            "path": "go.mod"
          },
          {
            "path": "go.sum"
          }
        ]
      },
      {
        "id": "package_manager:npm",
        "name": "npm",
        "kind": "package_manager",
        "locations": [
          {
            "path": "package-lock.json"
          },
          {
            "path": "package.json"
          }
        ]
      },
      {
        "id": "package_manager:poetry",
        "name": "poetry",
        "kind": "package_manager",
        "locations": [
          {
            "path": "python/poetry.lock"
          }
        ]
      },
      {
        "id": "package_manager:python",
        "name": "python",
        "kind": "package_manager",
        "locations": [
          {
            "path": "python/pyproject.toml"
          }
        ]
      }
    ],
    "manifests": [
      {
        "id": "manifest:go.mod",
        "name": "go.mod",
        "kind": "manifest",
        "ecosystem": "go",
        "package_manager": "go",
        "locations": [
          {
            "path": "go.mod"
          }
        ]
      },
      {
        "id": "manifest:package.json",
        "name": "package.json",
        "kind": "manifest",
        "ecosystem": "node",
        "package_manager": "npm",
        "locations": [
          {
            "path": "package.json"
          }
        ]
      },
      {
        "id": "manifest:python/pyproject.toml",
        "name": "pyproject.toml",
        "kind": "manifest",
        "ecosystem": "python",
        "package_manager": "python",
        "locations": [
          {
            "path": "python/pyproject.toml"
          }
        ]
      }
    ],
    "lockfiles": [
      {
        "id": "lockfile:go.sum",
        "name": "go.sum",
        "kind": "lockfile",
        "ecosystem": "go",
        "package_manager": "go",
        "locations": [
          {
            "path": "go.sum"
          }
        ]
      },
      {
        "id": "lockfile:package-lock.json",
        "name": "package-lock.json",
        "kind": "lockfile",
        "ecosystem": "node",
        "package_manager": "npm",
        "locations": [
          {
            "path": "package-lock.json"
          }
        ]
      },
      {
        "id": "lockfile:python/poetry.lock",
        "name": "poetry.lock",
        "kind": "lockfile",
        "ecosystem": "python",
        "package_manager": "poetry",
        "locations": [
          {
            "path": "python/poetry.lock"
          }
        ]
      }
    ],
    "ci_workflows": [],
    "dependency_bots": [],
    "package_manager_config_files": []
  },
  "warnings": [],
  "findings": [],
  "suppressed_findings": [],
  "rules": [
    {
      "id": "PW-R000",
      "ecosystem": "repository",
      "category": "foundation",
      "severity": "info",
      "profiles": [
        "strict"
      ],
      "remediation": "No remediation; this rule verifies rule engine execution.",
      "references": [],
      "enabled": true
    },
    {
      "id": "PW-R001",
      "ecosystem": "multi",
      "category": "lockfile",
      "severity": "medium",
      "profiles": [
        "baseline",
        "strict"
      ],
      "remediation": "Commit the package-manager lockfile for each manifest where the ecosystem supports lockfiles.",
      "references": [],
      "enabled": true
    }
  ],
  "profiles": [
    {
      "id": "baseline",
      "name": "Baseline",
      "description": "Default hardening checks for common repository package-manager configuration."
    },
    {
      "id": "strict",
      "name": "Strict",
      "description": "Higher-signal hardening checks for repositories that want a more restrictive posture."
    },
    {
      "id": "socket-firewall",
      "name": "Socket Firewall",
      "description": "Checks relevant to repositories using Socket Firewall controls."
    },
    {
      "id": "veracode-package-firewall",
      "name": "Veracode Package Firewall",
      "description": "Checks relevant to repositories using Veracode Package Firewall controls."
    },
    {
      "id": "private-registry",
      "name": "Private Registry",
      "description": "Checks relevant to repositories that route dependencies through private registries."
    }
  ],
  "policy": {
    "profiles": [
      "strict"
    ],
    "rules": {
      "enabled": [],
      "disabled": []
    },
    "suppressions": []
  }
}
